标题,作者,摘要,关键词
人工智能在军事对抗中的应用进展,"张智敏,石飞飞,万月亮,徐阳,张帆,宁焕生",人工智能特别是近几年深度学习的飞速发展，深刻的影响着军事领域，并赋予现代战争智能性、交叉性和破坏性的新特点。要想在军事对抗中取胜，不仅需要机器智能，同样需要人类智慧，能在军事作战中达到人机高度协同，是实现人与机器取长补短的重要途径，也是在愈发复杂的战争形势中取得胜利的关键。本文将军事对抗中人工智能的应用作为切入点，罗列了代表性国家在军事领域对人工智能的重视程度，从对抗策略和物联网三层架构两大角度对发展现状进行总结，同时指出在目前军事领域使用人工智能存在的不足，对人机融合智能在军事对抗中的发展趋势进行分析，并给出可能实现的技术方案，对未来的研究方向作出展望。如何实现高度的人机融合，从而获得“1+1>2”的良好效果，是人工智能在军事对抗中的下一步研究工作。,"人工智能,军事对抗,物联网,人机融合智能,技术方案"
神经形态硬件驱动的环境交互人工智能,"张涛,李子昂,陈吉堃,张海天",在过去的几十年里，人工智能（AI）技术迅速发展. 从完成简单任务的自动化设备到具有一定学习能力的智能机器人，AI正以前所未有的速度改变着世界. 但真正的智能不仅仅在于高效处理大量数据和执行预设任务，更在于与环境的深度互动和自适应决策等能力. 这就要求AI系统突破现有模式的多重限制，例如离散符号处理与物理世界连续性之间的根本矛盾，固定特征空间与开放环境无限可能性的相互冲突，以及静态部署方式与动态演化需求的彼此割裂等问题，最终实现自主感知周围环境，主动适应环境变化并完成独立学习和决策，摆脱对人工干预高度的依赖. 本文针对AI与环境的交互技术进行简要综述，讨论当前的进展并展望未来AI系统在环境互动中的创新和应用，以及相应电子材料的发展和未来挑战.,"人工智能,环境交互,硬件自适应,神经形态器件,神经网络"
在管道支吊架CAD中采用人工智能技术,余国海,"本文介绍了用TURBOPROLOG语言将人工智能技术用于吊架CAD系统,其中关于知识库的设计和知识库的搜索等问题,还用源程序作了详细说明。","计算机辅助设计,专家系统辅助设计,人工智能,计算机应用"
面向6G的空天地一体化网络：人工智能赋能优化机制综述,"李琳佩, 张海君(通讯作者), 孙春蕾, 管婉青, 张美杰","随着6G通信技术的发展，空天地一体化网络（Space-Air-Ground Integrated Network, SAGIN）在应急通信、环境监测、智能交通等领域展现出巨大的潜力，然而SAGIN具有异构结构、链路动态性高、资源分布广泛等特征，给网络的高效管理与优化带来巨大的挑战。近年来，人工智能（Artificial Intelligence, AI）技术的快速发展与在通信网络中的应用，为SAGIN的智能演进提供了新契机。本文首先系统介绍SAGIN网络架构的基本组成与关键特征，并梳理当前主流AI技术的技术原理与适配优势。其次，本文深入探讨了AI技术在SAGIN中智能资源管理、移动性管理、空中平台路径规划、路由与链路选择优化、网络切片与资源编排、任务卸载与计算协同等典型场景中的应用与最新进展。最后，本文总结了AI技术应用在SAGIN网络中面临的挑战并展望了AI与SAGIN融合发展的未来方向。本文总结了AI技术在SAGIN网络中应用的优势与进展，旨在为AI赋能的SAGIN研究与应用发展提供技术参考。","6G,空天地一体化网络,人工智能,深度强化学习,资源管理"
锻件计算机辅助工艺规程设计,"许耀昌,苏红","以人工智能和计算机辅助设计技术为基础,锻件的计算机辅助工艺规程设计采用LISP语言,并使用人工移植方法把锻造工序中的经验用产生式规则表达.推理过程中采用了逆向推理方法.计算结果与实际吻合.","人工智能,计算机辅助设计,锻件/计算机辅助工艺规程设计"
油气资源开发的大数据智能平台及应用分析,"宋洪庆,都书一,周园春,王宇赫,王九龙",油气资源大数据智能平台的总体框架应以数据资源为基础、大数据平台算力为支撑、人工智能算法为核心，面向油气行业生产需求，构建集勘探、开发、生产数据于一体的油气数据资源池，通过数据清洗与融合提升数据质量，整合物理模拟与数据挖掘等手段，实现服务功能模块化，并在PC端、管控大屏、手机移动APP等多维平台实现智能监测、预警与展示。通过对深度学习等人工智能方法在油气工业领域的应用案例分析，表明其具有较好的应用前景。未来石油公司应与科研院所通力合作，挖掘石油工业数据的巨大潜能，实现降本增效，建设全新的智能油气工业生态圈，完成产业升级。,"石油,天然气,大数据,人工智能,深度学习,机器学习"
高炉异常炉况诊断专家系统,"杨天钧,张开旗,周渝生,左广庆,徐金梧","高炉是一个包括复杂物理化学变化和传输过程的高温反应器。由局部反应和区域热平衡、物料平衡建立的机理模型难以适应炉况的迅速变化。用模糊数学理论进行不确定知识的处理,构成了知识库和推理机,从而建立了人工智能高炉异常炉况诊断专家系统,避免了人工可能漏看忽略的仪表微小变化所造成炉况判断的偏差,因而有较高的命中率。","高炉,专家系统,人工智能,模糊数学"
无人集群系统深度强化学习控制研究进展,"梁鸿涛,王耀南,华和安,钟杭,郑成宏,曾俊豪,梁嘉诚,李政辰",随着无人集群在物流运输、农业管理、军事行动等场景的试验和应用，其面临的作业环境和任务内容日趋复杂，亟需设计效率更高、泛化能力更强、适应性更好的控制算法. 将人工智能引入到无人集群系统控制的研究中，能够大幅提升现有无人集群的能力，完成复杂的作业任务. 深度强化学习具有深度学习和强化学习的优点，无人集群系统深度强化学习控制研究受到了国内外科研人员的广泛关注，涌现出许多标志性成果. 本文将从原理、特点等方面阐述深度强化学习概念，深入分析深度强化学习的多种典型算法，并讨论无人机集群的各类控制需求，进而介绍深度强化学习在无人机集群控制领域的典型研究成果，最后针对该领域研究成果的落地转化总结了应用前景和面临的挑战.,"无人集群,集群控制,深度强化学习,多智能体,人工智能,集群智能"
大语言模型研究现状与趋势,"王耀祖,李擎,戴张杰,徐越",在过去20年中，语言建模（Language models，LM）已经成为一种主要方法，用于语言理解和生成，同时作为自然语言处理（Natural language processing，NLP）领域下游的关键技术受到广泛关注. 近年来，大语言模型（Large language models，LLMs），例如ChatGPT等技术，取得了显著进展，对人工智能乃至其他领域的变革和发展产生了深远的影响. 鉴于LLMs迅猛的发展，本文首先对LLMs相关技术架构和模型规模等方面的演进历程进行了全面综述，总结了模型训练方法、优化技术以及评估手段. 随后，分析了LLMs在教育、医疗、金融、工业等领域的应用现状，同时讨论了它们的优势和局限性. 此外，还探讨了大语言模型针对社会伦理、隐私和安全等方面引发的安全性与一致性问题及技术措施. 最后，展望了大语言模型未来的研究趋势，包括模型的规模与效能、多模态处理、社会影响等方面的发展方向. 本文通过全面分析当前研究状况和未来走向，旨在为研究者提供关于大语言模型的深刻见解和启发，以推动该领域的进一步发展.,"大语言模型(LLMs),自然语言处理,深度学习,人工智能,ChatGPT"
人工心理学——关于更接近人脑工作模式的科学,王志良,"在人工智能的基础上,首次提出人工心理理论的概念,即:利用信息科学的研究方法,对人的心理活动的更全面内容(尤其是情感、意志、性格、创造等)的人工机器实现.探索性提出了人工心理学的定义、目的、法则、研究内容、应用范围、研究方法等问题,试图确立人工心理学理论结构体系,有利于人工智能的研究走向更深、更高层次.","人工心理,拟人控制,计算机软件"
高炉泥炮打泥机构智能型计算机辅助设计,卞致瑞,"提供了一种机械设备的智能型计算机辅助设计系统,它的特点在于,根据设备设计各个阶段的特点,分别采用了智能推理、类比设计的人工智能选型、机械零件常规的设计计算及零件的优化设计.","高炉泥炮,机械设计"
神经网络专家系统的状态识别、知识表示和求解策略,"郑德玲,李育晖","将神经网络与人工智能技术相结合,提出了1种新型的知识表示的形式化描述和知识单元。知识通过模式分类导入,并用IMSBP和(B-B)BP调节2种不同类型的权。在此基础上提出了神经网络的双向求解策略。以加热炉控制验证了其可行性。","专家系统,神经网络,状态识别,自学习"
图像数据库的智能检索,"吴斌,王秉钦","提出了以人工智能思想为指导的图像数据库的智能检索方法,它利用模式识别技术和图像处理技术,同时考虑启发性知识.该方法用图像特征向量代表图像并进行聚类分析以建立图像库的检索树,应用最佳优先搜索方法在检索树上找出用户满意的图像.重点探讨了如何利用专家的经验知识和通过样本训练得到启发评价函数,并推出了启发评价函数存在的条件.","图像数据库,智能检索,聚类,评价函数"
故障诊断·机械设计综合专家系统,翁海珊,"运用人工智能(AI)理论和知识工程技术,使传统的设备故障诊断系统成为基于深知识的知识中心型专家系统。它与机械设计专家系统利用同样的对象模型及其阶层构造和性能框架,在进行设计推理,探索最优设计方案的同时,从深知识推导出诊断故障所需的因果关系,寻找设备的故障及其原因所在,从而使原本各自独立存在、独立运行的两类专家系统融成一体,形成故障诊断,机械设计综合专家系统。","知识工程,专家系统,故障诊断,机械设计,深知识"
深度神经网络模型量化方法综述,"杨春,张睿尧,黄泷,遆书童,林金辉,董志伟,陈松路,刘艳,殷绪成",近年来，利用大型预训练模型来提高深度神经网络在计算机视觉以及自然语言处理等具体任务下的泛化能力和性能，逐渐成为基于深度学习的人工智能技术与应用的发展趋势. 虽然这些深度神经网络模型表现优异，但是由于模型的结构复杂、参数量庞大与计算成本极高，使得它们仍然难以被部署在如家电或智能手机等资源受限的边缘及端侧硬件平台上，这很大程度上阻碍了人工智能技术的应用. 因此，模型压缩与加速技术一直都是深度神经网络模型大规模商业化应用推广的关键问题之一. 当前在多种模型压缩与加速方案中，模型量化是其中主要的有效方法之一. 模型量化技术可以通过减少深度神经网络模型参数的位宽和中间过程特征图的位宽，从而达到压缩加速深度神经网络的目的，使量化后的网络能够部署在资源有限的边缘设备上，然而，由于量化会导致信息的大量丢失，如何在保证模型任务精度条件下实现模型量化已经成为热点问题. 另外，因硬件设备以及应用场景的不同，模型量化技术已经发展成为一个多分支的研究问题. 通过全面地调研不同角度下模型量化相关技术现状，并且深入地总结归纳不同方法的优缺点，可以发现量化技术目前仍然存在的问题，并为未来可能的发展指明方向.,"深度神经网络,模型压缩与加速,模型量化,量化感知训练,后训练量化,混合精度量化"
图模型在分子信息学中的研究综述与展望,"戴嘉欣,付冬梅,张达威,马菱薇",分子信息学作为化学与人工智能交叉融合的前沿领域，正迅速推动药物设计与功能材料开发等领域的技术革新. 分子表示学习作为其核心基础，通过将分子结构编码成保留其拓扑与理化性质的数值向量，为分子性质预测和分子生成等下游任务提供高效特征表示. 相比基于规则和基于字符序列的表征，图模型能够充分利用分子天然的图结构（原子为节点、化学键为边），能够精准捕捉分子拓扑信息和复杂相互作用，现已成为该领域的主流技术. 本文系统综述了图模型在分子信息学中的最新研究进展和应用. 首先详细梳理了分子表征方法的发展历程，阐述图模型的基本概念和独特优势. 其次，围绕分子性质预测和分子生成两大核心任务，系统梳理了常用数据集、评价指标以及各类图判别和图生成模型的特点与研究现状. 同时，结合材料性能预测与晶体生成任务，探讨了不同深度图模型在实际应用中的优缺点、适用场景以及技术挑战. 最后，探讨了大规模预训练、可解释性方法和多模态学习等新兴趋势在分子信息学中的应用潜力，并展望了未来研究方向. 本综述旨在为化学领域研究者快速定位前沿技术与适用方法，同时为人工智能领域研究者梳理技术路线，以推动更高效的算法设计及其在分子信息学中的落地应用.,"图模型,分子信息学,分子性质预测,分子生成,分子表示学习"
文本生成领域的深度强化学习研究进展,"徐聪,李擎,张德政,陈鹏,崔家瑞",谷歌的人工智能系统（AlphaGo）在围棋领域取得了一系列成功，使得深度强化学习得到越来越多的关注。深度强化学习融合了深度学习对复杂环境的感知能力和强化学习对复杂情景的决策能力。而自然语言处理过程中有着数量巨大的词汇或者语句需要表征，并且在对话系统、机器翻译和图像描述等文本生成任务中存在大量难以建模的决策问题。这使得深度强化学习在自然语言处理的文本生成任务中能够发挥重要的作用，帮助改进现有的模型结构或者训练机制，并且已经取得了很多显著的成果。为此，本文系统阐述深度强化学习应用在不同的文本生成任务中的一些主要方法，梳理其发展的轨迹，分析算法特点。最后，展望深度强化学习与自然语言处理任务融合的前景和挑战。,"深度强化学习,自然语言处理,文本生成,对话系统,机器翻译,图像描述"
协同智能网格及其实现架构,"沈记全,贾宗璞,涂序彦","为了提高网格的智能水平和协调能力以及协同分布的网格服务,支持动态的计算环境和多变的用户需求,提出了协同智能网格CIG(cooperative intelligent grid).CIG以OGSA为基础,应用分布式人工智能和分布协调控制的理论和方法来研究和解决网格中如何高效准确地协同现有的网格服务以完成所面临的任务.文中描述了CIG的概念和体系结构,从社区/联邦式政策导向型的系统结构、领域自适应的中介服务协作机制和理性化协商机制等方面构建开放动态的CIG.CIG可以有效地组织各网格实体的协调、协商和合作,提高了服务组合的自动化程度和抽象层次.","网格服务,代理,中介服务,心理模型"
多机器人编队控制研究进展,"贾永楠,李擎","首先介绍了传统的编队控制方法的定义、特点和常用方法及优缺点，并将传统编队控制时代定义为前编队控制时代.随着多智能体技术的发展，将多智能体技术引入到编队控制问题中，诞生了众多新的研究成果，称为后编队控制时代.后编队控制时代以多智能体技术为基础，随着通信技术、计算机技术、人工智能技术的发展而逐渐壮大起来，并受到了学者的广泛关注.前编队控制时代强调多机器人通过编队协作完成单个机器人无法实现的任务，提高任务完成效率且缩短任务完成时间.后编队控制时代则是在前编队控制时代的基础上，更强调低成本、同步性和协同性，但却不那么重视每个个体的任务分工，甚至是按照规则自由分配任务，不再有""不可替代""的个体存在.最后给出了研究编队控制问题的基本思路和目前尚待解决的关键问题.","机器人,编队控制,多智能体技术,大规模系统,分布式控制"
基于CART决策树的冲压成形仿真数据挖掘,"王伟,黄宇星,余鸿敏","油箱壳外形复杂,拉深成形过程中容易出现侧壁起皱和圆角处破裂的缺陷,成形工艺参数的确定非常重要.结合分类与回归决策树(classification and regression tree,CART)的人工智能技术和模型交叉验证方法,通过调用Python平台开源库Scikit-Learn对油箱壳拉深成形数值模拟结果进行知识挖掘,筛选出对油箱壳拉深成形影响大的工艺参数;以基尼指数(Gini index)最小化作为最优特征值及最优切分点选择的依据,构建了工艺参数与性能指标关系的CART决策树,提取出了可靠的工艺设计规则.油箱壳拉深实例表明,CART决策树理论的知识发现技术是实现板料成形过程数值模拟结果潜在知识挖掘的可行途径.","知识发现,数据挖掘,数值仿真,分类与回归树,主成分分析"
数字孪生技术在智慧医疗与健康领域的技术、应用与挑战综述,"林雨嘉,李金海,宁焕生,石飞飞",随着人工智能、云计算、5G等先进技术的发展，数字孪生技术在智慧医疗与健康领域的应用日益广泛，医疗数字孪生的概念随之应运而生. 在这一新兴领域中，患者作为医疗数字孪生研究的核心与难点，对其进行研究可以更好地挖掘并满足患者医疗需求，为个性化医疗服务增质提效. 因此，本文首先详细调研了医疗数字孪生的国家政策导向、学术研究动态以及国际组织情况. 其次，聚焦患者群体构建了医疗数字孪生的综合技术框架，详细剖析了数字支撑技术、孪生体构建技术与人机交互技术这三类关键技术. 第三，本文详细阐述了医疗数字孪生的五大主要应用：运动训练、疾病预测、临床治疗、康复管理及医药试验. 最后，本文对数字孪生技术在智慧医疗与健康领域存在的数据异构、经验主义、安全隐私等问题进行讨论和分析，并提出了针对性的对策.,"数字孪生,智慧医疗与健康,医疗数字孪生,疾病预测,个性化医疗"
自注意力指导的多序列融合肝细胞癌分化判别模型,"贾熹滨,孙政,杨大为,杨正汉","结合影像学和人工智能技术对病灶进行无创性定量分析是目前智慧医疗的一个重要研究方向。针对肝细胞癌（Hepatocellular carcinoma, HCC）分化程度的无创性定量估测方法研究，结合放射科医师的临床读片经验，提出了一种基于自注意力指导的多序列融合肝细胞癌组织学分化程度无创判别计算模型。以动态对比增强核磁共振成像（Dynamic contrast-enhanced magnetic resonance imaging, DCE-MRI）的多个序列为输入，学习各时序序列及各序列的多层扫描切片在分化程度判别任务的权重，加权序列中具有的良好判别性能的时间和空间特征，以提升分化程度判别性能。模型的训练和测试在三甲医院的临床数据集上进行，实验结果表明，本文所提出的肝细胞癌分化程度判别模型取得相比几种基准和主流模型最高的分类计算性能，在WHO组织学分级任务中，判别准确度、灵敏度、精确度分别达到80%，82%和82%。","肝细胞癌分级,动态对比增强核磁共振成像,自注意力机制,多序列融合,辅助诊断"
协作机器人智能控制与人机交互研究综述,"黄海丰,刘培森,李擎,于欣波",协作机器人是一类能够在共享空间中与人类交互或在人类附近安全工作的新型工业机器人，由于其轻质、安全的特点，在柔性制造、社会服务、医疗健康、防灾抗疫等多个领域展现出了良好的应用前景，受到工业界和学术界的广泛关注，成为当前机器人领域的研究热点之一。协作机器人需要具备良好的控制性能确保与人交互的安全性，集成多种传感器感知外部环境并应用智能控制理论与方法来确保高效的协作行为。在我国，人机协作已列入《智能制造2025》和《新一代人工智能发展规划》重点支持研究计划。本文主要介绍了国内外几款常见的协作机器人，机器人基于感知信息的控制、高精度跟踪控制、交互控制等智能控制方法，并围绕机器人与人执行协作任务的高效性，对机器人的人类意图估计和技能学习方法进行了讨论。最终对协作机器人未来的发展方向进行了展望。,"协作机器人,智能控制,人机交互,机器人技能学习,人类意图估计"
中国非开挖水平定向钻进装备与技术研究应用进展,"孙平贺,刘伟胜,杨涵涵,韦帮第,夏余宏烨",从非开挖水平定向钻进（Horizontal directional drilling，HDD）装备技术、地下生命线工程的探测与信息化、双向对穿HDD技术、大口径HDD技术、HDD回拖力计算模型、地表变形与冒浆6个方面开展了文献调研工作，分析了HDD装备与技术研究应用进展：世界上最大回拖力（20000 kN）的电驱动钻机被设计并研发；电磁感应法被广泛用于既有生命线的空间探测，复杂干扰下的数据解析与精度提高仍是研究重点；基于三维数据，融合建筑信息模型、人工智能、大数据等技术，借鉴美国“811”体系，局部完成了地下生命线的信息化；采用对穿技术完成了长距离的地下生命线敷设；基于过程化的HDD工艺参数、设备参数和控制监测技术被大量应用，有效提升了应用中的风险识别能力；针对不同地层条件下的回拖力计算为设备选型提供了依据，并为HDD多学科融合研究提供了途径；复杂地质条件下的冒浆、卡钻等热点和难点也得到初步探索研究，构建了理论、实验和数值分析模式，为提高HDD的应用效率和质量提供了依据。综合国内外研究进展，进一步分析了HDD的发展趋势。,"非开挖,生命线工程,地下工程,钻探技术,风险控制"
5G环境下基于深度学习的云化PLC物料识别与定位系统,"付美霞,王健全,王曲,孙雷,马彰超,张超一,管婉青,李卫",为了解决智能制造领域中云化控制与视觉分选应用相结合的问题，提出了基于深度学习的云化可编程逻辑控制器（Programmable logic controller，PLC）物料识别与定位系统，并在端到端5G与时间敏感网络（Time sensitive networking，TSN）传输网络环境下，实现了对云化PLC架构和控制功能有效性的验证。首先，将传统PLC系统控制功能容器虚拟化，实现PLC的本地和云端自由部署；其次，在云端设计人工智能学习平台，采用基于You only look once v5 （YOLOv5）的目标检测算法实现物料的定位和分类，获取目标的像素坐标和类别信息；然后，利用相机标定方法把像素坐标转换成物理世界坐标，并将目标类别、坐标、时间戳信息传输到云化PLC；最后，在5G和TSN融合网络环境下，实现云化PLC对天车设备的实时控制与复杂计算功能整合。结果表明，该系统能够有效的对多天车进行协同控制，物料定位均值平均精度（Mean average precision，mAP）达到99.65%，分选准确率达到96.67%，平均消耗时间225.99 s，满足工业低时延、高精度的视觉分选需求。,"智能制造,视觉分选,深度学习,云化可编程逻辑控制器,5G,时间敏感网络"
