标题,作者,摘要,关键词
基于学习机制的多智能体强化学习综述,"王若男,董琦",强化学习作为人工智能领域的重要分支，以其在多智能体系统决策中的卓越表现，成为当前主流方法. 然而，传统的多智能体强化学习算法在面对维度爆炸、训练样本稀缺和难以迁移等方面仍然存在困难. 为了克服这些挑战并提升算法性能，本文从学习机制的角度入手，深入研究学习机制与强化学习的深度融合，以推动多智能体强化学习算法的发展. 首先，介绍了多智能体强化学习算法的基本原理、发展历程以及算法所面临的难点. 随后，引入了基于学习机制的多智能体强化学习方法这一种新兴方向. 这些学习机制，如元学习和迁移学习，被证明可以有效提升多智能体的学习速度，并缓解维度爆炸等问题. 按照课程学习、演化博弈、元学习、分层学习、迁移学习等学习机制在多智能体强化学习中的应用进行了综述，通过罗列这些方法的研究成果，论述了各种方法的局限性，并提出了未来改进的方向. 总结了这类融合算法在实际应用中取得的提升成果和实际应用，具体列举了基于学习机制的多智能体强化学习算法在交通控制、游戏领域的实际应用案例. 同时，对这类融合算法未来在理论、算法和应用方面的发展方向进行了深入分析. 这涵盖了对新颖理论的探索、算法性能的进一步优化，以及在更广泛领域中的推广应用. 通过这样的综述和分析，为未来多智能体强化学习算法的研究方向和实际应用提供了有益的参考.,"强化学习,多智能体博弈,学习机制,课程学习,演化强化学习"
岩石爆破基础理论研究进展与展望Ⅰ—本构关系,"杨阳,杨仁树,陈骏,方士正,李炜煜,范子儀,张祥,朱锐,张渊通,杨欢,王雁冰",岩石爆破技术在国民经济建设中发挥着重要作用，尤其在资源开采、基础设施建设等领域. 本文对岩石爆破本构关系进行了深入研究和探讨，在传统本构关系研究的基础上，提出了本构关系1.0、2.0和3.0的演化阶段，分别探讨了矛盾关系、能量平衡以及最小作用量理论. 本构关系1.0从岩石与爆炸、冲击荷载的相互作用出发，强调了矛与盾的关系，重点分析了岩石材料的动态力学响应；本构关系2.0以能量为切入点，将含有节理裂隙、层理和腔体等缺陷以及显著各向异性的岩石视为复杂结构材料，研究荷载输入能量与材料破坏所需能量之间的动态平衡关系，解析结构强度与输入能、耗散能及可释放应变能之间的关联；本构关系3.0关注爆炸荷载下应力波的传播规律及其与介质破坏效应的关系，特别是通过最小作用量理论来优化能量的传播路径，提高炸药能量的利用效率. 这些理论不仅揭示了岩石在不同荷载条件下的力学行为，还为优化爆破设计和改善爆破效果提供了理论依据. 同时，本文结合人工智能和大数据技术，提出了岩石材料工程基因的概念，通过建立岩石基因库，系统化管理岩石的物理力学参数，构建性能预测模型，提升了对岩石特性的理解和工程应用的精确度. 未来，岩石材料基因库有望在矿产资源开发、地质灾害防治和基础设施建设等领域发挥更大的作用，推动工程技术的发展和应用.,"岩石爆破,本构关系,矛盾关系,能量平衡,最小作用量"
复杂天气下车载激光点云目标检测方法综述,"武雨田,李擎,孙文蔚,王恒,王巍然",随着传感器、数据处理、视觉感知、控制决策、人工智能等自动驾驶相关技术的不断发展，自动驾驶成为汽车行业未来发展的重要方向之一. 但是，以雨、雾、雪等复杂天气为典型代表的极端驾驶环境，对自动驾驶环境感知提出了严峻挑战. 随着激光雷达（Light detection and ranging，LiDAR）在汽车上得到广泛运用，基于车载激光点云的目标检测已成为自动驾驶环境感知的重要研究方向之一，但在复杂天气条件下，LiDAR探测生成的点云存在大量噪点，对目标检测的性能产生严重负面影响. 对此，本文首先归纳了点云目标检测的基本定义、任务方法和评测指标，然后分析了复杂天气对点云目标检测的影响，并从数据增强、点云去噪、域自适应以及传感器融合等四个方面，系统分析了复杂天气下基于车载激光点云的目标检测方法及其优缺点，最后探讨了当前存在的数据规模与真实性不足、模型结构复杂、数据分布不均匀、实际部署瓶颈等问题以及未来研究方向.,"激光雷达,目标检测,自动驾驶,复杂天气,深度学习"
耐候钢锈层在大气环境中的防护机制及其稳定化处理技术,"高君懿,徐玮辰,张斌斌,李灿明,李国宝,侯保荣",耐候钢能够自发形成具有防护作用的锈层. 稳定致密且贴附表面的锈层能够有效地阻碍腐蚀介质与基体的接触，可在自然环境中发挥优异的耐腐蚀性. 本文从锈层结构、锈层成分和形成机制等方面对耐候钢的锈层保护性能进行了阐述，讨论了初期锈层的形成过程，明确了锈层复层结构的精细划分以及各层腐蚀产物对耐候钢耐蚀性的实际贡献. 详细分析了合金化元素、环境因素（盐度、温度、湿度、辐照等）对保护性锈层形成和稳定化的影响机制，明确了传统的Cr、Cu、Ni等合金元素以及Sn、Mo、稀土元素等其他元素对有效腐蚀产物的形成、锈层形核、锈层致密性或粘结强度等的作用机制. 目前针对锈层耐蚀性的研究工作正在向人工智能、先进传感器和大数据技术等新兴领域扩展，但在复杂大气环境（如海洋–工业大气复合环境）对锈层形成的作用机制、多种合金元素共存的影响等方面还存在明显不足. 更重要的是，由于完整稳定锈层的形成条件苛刻，在恶劣环境中甚至难以形成保护性锈层，仍然需要相应的防护措施. 详细讨论了现有的锈层稳定化处理技术，从涂膜技术、喷淋技术、锈层表面重构技术等方面阐述了现有的主要技术路线，对提升耐候钢的可靠性、稳定性和适用性具有重要意义，高效环保的锈层稳定化处理技术将是未来重要的发展方向之一.,"耐候钢,大气腐蚀,锈层,合金化元素,环境,锈层稳定化处理"
基于参数惩罚和经验回放的材料吸声系数回归增量学习,"王弘业,钱权,武星","材料数据具有分批次、分阶段制备的特点，并且不同批次数据的分布也不同，而神经网络按批次学习材料数据时会存在平均准确率随批次下降的问题，这为人工智能应用于材料领域带来极大的挑战。为解决这个问题，将增量学习应用于材料数据的学习上，通过分析模型参数的变化，建立了参数惩罚机制以限制模型在学习新数据时对新数据过拟合的现象；通过增强样本空间多样性，提出经验回放方法应用于增量学习，将新数据与从缓存池中采样得到的旧数据进行联合训练。进一步地，将所提方法分别应用在材料吸声系数回归和图像分类任务上，实验结果表明采用增量学习方法后，平均准确率分别提升了45.93%和2.62%，平均遗忘率分别降低了2.25%和7.54%。除此之外，还分析了参数惩罚和经验回放方法中具体参数对平均准确率的影响, 结果显示平均准确率随着回放比例的增大而增大，随着惩罚系数的增大先增大后减小。综上所述，本文提出的方法能够跨模态、任务进行学习，且参数设置灵活，可以根据不同环境和任务进行变动，为材料数据的增量学习提供了可行的方案。","材料数据,神经网络,增量学习,参数惩罚,经验回放"
Web 3.0概念、内涵、技术及发展现状,"徐蕾,李莎,宁焕生",Web 3.0作为人类所期待的下一代互联网受到了学术界、产业界等广泛关注，本文从不同国家（包括政策、公司和产品）、国际组织（ITU、IEEE、IET、W3C）和数据库（Scopus、CNKI）出版物数量角度分析了Web 3.0的发展历程以及发展现状，得出Web 3.0中的基础技术仍然是制约其发展的瓶颈.本文对Web 3.0中的基础技术深入剖析，从网络与计算技术（5G、6G、物联网、云计算、边缘计算及端计算），安全可信技术（区块链技术、隐私计算、身份管理技术），虚实融合技术（虚实交互技术、IoX、跨链技术），智能交互技术（语义网、大数据与数据挖掘、人工智能）四个维度进行阐述.最后对未来Web 3.0在经济、社会、文化方面引起的变革进行了总结.目前无论基于是信息技术升级的需求，还是走出疫情困扰持续低迷的全球经济需求，都需要Web 3.0为经济、科技、文化、社会的变革注入新动能.,"Web 3.0,网络与计算,安全可信,虚实融合,智能交互"
微细粒矿物浮选捕收剂的应用及其机理研究进展,"常自勇,李玉娇,沈政昌,邹来昌,王乾坤,孙忠梅,王化军",详细阐述了常用微细粒矿物浮选捕收剂的分类以及组合捕收剂的应用，对单一捕收剂和组合捕收剂在矿物表面的作用机理进行了系统的归纳总结. 微细粒矿物浮选捕收剂可大致分为硫化矿捕收剂和氧化矿捕收剂，依据其主要成分可进一步分为阳离子型捕收剂、阴离子型捕收剂、非离子型捕收剂、生物捕收剂和纳米粒子捕收剂，作用机理主要包括静电相互作用、螯合作用、氢键作用、化学键合以及金属离子配位调控分子组装等. 组合捕收剂对微细粒矿物的浮选效果往往优于单一捕收剂，不同捕收剂间的协同作用主要包括共吸附、电荷补偿、功能互补以及改变临界胶束浓度等. 未来应加强基于计算化学和人工智能的新型捕收剂药剂分子结构设计、纳米粒子捕收剂的研发以及新型绿色环保捕收剂的开发与利用.,"浮选捕收剂,微细粒,组合捕收剂,纳米捕收剂,作用机理"
基于动态贝叶斯网络的多无人机集群对抗策略,"贾永楠,焦宇航,陈萱,李擎,鲁小雅",红蓝双方集群攻防对抗博弈问题是近年来复杂系统研究领域的热点和难点，在军事领域、网络安全领域和人工智能领域均具有重要的应用价值. 在实际对抗中，环境的不确定性和智能体行为的多样性导致问题难以建模，而实战环境又要求智能体能够对态势的变化给出实时、高效的响应. 为解决上述问题，本文提出了一种面向红蓝双方集群攻防对抗博弈问题的研究框架. 首先，提出了一种基于改进后的兰彻斯特方程的对抗博弈模型，并在此基础上探讨了如何适应性改进Kuhn–Munkres（KM）算法以解决对抗博弈过程中的多目标任务分配问题. 其次，为了提升无人机个体的环境适应性，提出了一种集群攻防对抗策略，利用动态贝叶斯网络对集群攻防对抗过程中产生的一系列不确定性因素进行实时、高效的推理和预测. 该策略可有效降低对抗模型的复杂度和计算量，广泛提高决策的精确性和快速性. 最后，基于上述对抗博弈模型搭建了仿真平台，实时展示红蓝双方无人机集群对抗过程，并对上述算法的有效性进行验证. 仿真结果表明，所提出的上述理论框架可以实现红蓝双方对抗模拟演示过程，可有效解决红蓝双方打击对抗过程中的多目标任务分配问题，并对对抗过程中所产生的不确定性因素进行合理的预测和评估.,"集群对抗,分布式协同,兰彻斯特方程,KM算法,动态贝叶斯网络"
基于多模态数据融合的边缘设备轻量级垃圾分类方法和系统研究,"肖克江,陈亮,高阔,杨文齐,庞世燕",随着人工智能技术的发展，基于神经网络的垃圾分类方法成为解决垃圾处理问题的重要手段，并得到了广泛应用. 但对于边缘设备而言，神经网络的可更新性与准确率提升仍需进一步研究. 本文提出了一种面向边缘设备的垃圾分类方法和系统. 首先，为解决神经网络在增量学习时面临的遗忘问题，本文采用多步知识蒸馏对AlexNet网络进行类别增量学习，形成了适用于垃圾分类的教师–助教–学生模型，使得AlexNet网络在学习新类别时保持对旧类别的判断能力. 其次，为克服图像特征不明显导致分类准确率降低的问题，本文引入了金属传感器数据和重量传感器数据，通过Q-learning算法将图像分类结果与多传感器数据进行加权融合，提高了分类的准确率和鲁棒性. 最后，本文在树莓派4B平台上设计与实现了垃圾分类系统，并在公开数据集TrashNet和自建数据集上进行了对比实验. 实验结果表明，所实现的垃圾分类系统在自建数据集的垃圾分类任务中平均分类准确率达到89.7%，单次分类平均所需时间为130 ms，实现了快速准确的垃圾分类，相较基于MobileNetV3的嵌入式算法提升了6.5%的准确率.,"垃圾分类,边缘设备,神经网络,知识蒸馏,类别增量学习,数据融合"
基于非局部网络与通道注意力机制的颈动脉狭窄分类模型,"李博涛,郑瀚,罗继昌,张桃红,焦力群,金紫薇",颈动脉狭窄是缺血性脑卒中的主要成因之一，目前数字减影造影技术(DSA)被称为颈动脉狭窄诊断的金标准，但传统的诊断方式需要由病理学家手动筛选分析DSA影像，存在着筛查速度慢、容易出错及对专业诊断人员的依赖等问题.人工智能为我们提供了辅助诊断手段. 但目前的识别往往诊断出一处狭窄就完成识别，而实际影像有时存在不止一处的问题，为提高影像对多处狭窄的识别能力，本文提出了一个非局部通道注意力网络（Non-local channel attention net，NLCANet）对颈动脉狭窄进行准确分类. 该模型主要由两个模块构成：非局部多尺度特征融合模块（Non local multi-scale fusion module，NLMSF）和通道注意力模块（Multi-level channel attention module，MLCA）. 非局部多尺度特征融合模块NLMSF利用非局部网络的思想来模拟空间注意力操作，同时，为了更好的提取多尺度特征，在非局部网络中还加入了多尺度特征融合的模块，对颈动脉影像分类起到重要作用；通道注意力模块MLCA通过高效的利用影像中的通道特征，为模型分类提供了更多的语义信息. 我们通过使用提取关键帧的技术，建立颈动脉狭窄数据集，将本文模型与其他主流的医学影像分类模型在该颈动脉狭窄数据集上进行对比. 我们的模型达到了最好的效果，模型的分类准确率要高于其他主流的模型至少2%.,"颈动脉狭窄,数字减影造影术,非局部网络,通道注意力,多尺度特征融合"
赛博学（Cyberism）——研究人与网络空间的学说,宁焕生,自早期人类以来的大约700万年中，人类一直生存在三个基本空间中，即物理空间（自然空间），社会空间和思维空间（认知空间）. 但随着电子计算机的诞生，以及后来的互联网和人工智能技术的发展，人类的生产和生活方式已经发生了极大改变，即在原来的三个基本生存空间之外，诞生了一个新的生存空间，即赛博空间（Cyberspace，网络空间）. 在我们的传统文化中，儒（Confucianism）是研究人与人（社会空间）的关系，释（Buddhism）是研究人与内心（思维空间）的关系，道（Daoism或Taoism）是研究人与自然（物理空间）的关系，而人与赛博空间（网络空间）关系还未得到深入研究. 本文首先提出赛博学（Cyberism）是专门研究人与赛博空间（网络空间）关系的学说，系统阐述赛博学中的一些基本问题，如：赛博哲学、赛博科学与赛博逻辑问题；赛博学中若干“人”的问题；赛博学中科技发展、社会与认知，以及网络空间生存带来的疾病与健康问题等. 其次研究了赛博空间引起的学科变革，即赛博学的学科体系及其对传统学科体系的影响. 最后展望了赛博学对未来人类文明进化、教育与科技创新的影响.,"赛博空间,赛博学,人机关系,数字人,网络病,学科体系,科技与文明进化"
原子级透射电镜图像自动化分析：发展与趋势,"张一凡, 贾宇, 李长泰, 何洋",透射电子显微镜（Transmission electron microscopy，TEM）是材料科学研究的重要表征手段，能够以原子级分辨率深入探索材料的晶体或分子结构。然而，原子级TEM数据具有高噪声、多成像模式等特性，导致了人工分析的复杂性高，限制了其在大规模数据处理和自动化分析中的应用。近年来，以深度学习（Deep learning，DL）为代表的人工智能（Artificial Intelligence，AI）技术的快速发展为原子级TEM数据的自动化及智能化处理提供了新方法。本综述系统回顾了原子级TEM数据自动化分析的发展过程与最新进展，重点讨论了基于深度学习的图像质量提升、原子精准定位和表征分析方法。首先，总结了规则化和深度学习去噪技术在提高原子级图像质量方面的应用；其次，介绍了深度学习在原子定位中的突破性进展，包括利用卷积神经网络、生成对抗网络及自监督学习方法实现复杂背景下的原子精确定位；最后，探讨了基于AI的表征分析如何推动原子级材料微观结构解析、缺陷识别、相变行为等研究。此外，总结了当前技术发展面临的主要挑战，包括数据质量、模型泛化性、可解释性以及物理约束的融合问题，并以“智能电镜”为切入口，展望了未来的发展趋势。,"透射电子显微镜 (TEM),深度学习,原子定位,图像质量提升,自动化分析,材料表征"
基于大语言模型和机器学习模型协作的特征筛选管道助力缓蚀剂精准预测,"杨景智,刘典典,龚海燕,郭鑫,金宇婷,马菱薇,张达威,李晓刚",从工农业生产到国防科技，材料腐蚀遍及国民经济中的各个领域，严重威胁设施装备服役安全，造成巨大的经济损失，对人类生命健康产生极大的威胁和隐患. 金属缓蚀剂能够改变金属表面状态，使电化学反应的活化能垒增高，从而减缓金属腐蚀速率. 缓蚀剂具有低剂量、低成本、高效率等优点，因此成为应用最广泛的腐蚀抑制手段之一. 然而，缓蚀剂的种类多样，作用机制复杂，且与环境因素密切相关. 传统的腐蚀研究方法，比如失重测试和电化学测试等通常需要大量的人力、物力成本和时间消耗，极大地阻碍了高性能缓蚀剂的设计与应用. 需要一种更加高效的技术手段推动缓蚀剂的研究. 近年来，材料基因工程技术的发展引领着腐蚀研究从经验试错向数字化、智能化方向变革，利用人工智能技术可实现对现有数据进行分析来预测庞大的未知空间，并探究材料成分、结构与性能的潜在关系. 本文基于大语言模型（LLM）和机器学习模型协作的特征筛选管道，借助系统性腐蚀知识注入、提示词设计和递归筛选等技术，从209种特征描述符中筛选得到13种与饱和CO2环境下缓蚀性能最相关的描述符，这些描述符涉及分子物理化学性质，分子结构性质以及环境参数. 筛选后，模型预测的均方误差由121降到11. 后续的腐蚀实验验证了模型的预测精度与泛化能力. 本文开发的缓蚀剂特征筛选流程与机器学习模型，显著提升了CO2环境下高性能缓蚀剂的研发效率.,"腐蚀与防护,缓蚀剂,机器学习,大语言模型,饱和CO2"
人才资源智能管理系统的设计,"丁左,田战强,张杰","以冶金工业部人才资源的管理问题为背景,给出了人才资源智能管理系统的具体设计方法.该系统中,广义的管理分析预测模型树用于其知识表达,系统结构由多库结构支持;在其推理机方面,应用元知识推理以协调定性推理、定量推理和人工神经网络推理.将有限的自然语言理解引入人-机界面,用TURBO PROLOG和C语言在IBM/AT微机上对该设计部分实现,表明了其合理性及可行性.","人工智能,管理/人才资源,智能管理系统"
领域通用IDSS生成器及其设计方法,张大海,"提出了领域通用决策支持系统生成器的概念,及其设计的可能性及必要性.同时给出了领域通用决策支持系统生成器的一种概念结构,并对其设计方法进行了探讨.","人工智能,决策支持系统,生成器,领域通用性,领域通用性"
